{
  "schemaVersion": 1,
  "mapId": "birdify-monorepo-architecture",
  "revision": 6,
  "language": "en",
  "project": {
    "id": "birdify",
    "name": "birdify",
    "translations": {
      "zh": {
        "name": "Birdify - 面向 AI 编程智能体的架构优先可视化工具"
      }
    }
  },
  "modules": [
    {
      "id": "cli",
      "role": "backend",
      "name": "Birdify CLI",
      "kind": "local",
      "responsibility": "Agent-first command-line tool for skill-driven validation, rendering, discovery, install, and project-mode operations.",
      "ownership": [
        {
          "kind": "file",
          "path": "apps/cli/src/birdify.ts"
        },
        {
          "kind": "file",
          "path": "apps/cli/src/commands/project.ts"
        }
      ],
      "evidence": [
        {
          "path": "apps/cli/src/birdify.ts",
          "symbol": "main",
          "note": "CLI command dispatcher calling @birdify/core commands.",
          "translations": {
            "zh": {
              "note": "调用 @birdify/core 核心能力的命令行入口分发器。"
            }
          }
        }
      ],
      "status": "supported",
      "openQuestions": [],
      "translations": {
        "zh": {
          "name": "Birdify 命令行工具",
          "responsibility": "由 Birdify 技能驱动的命令行工具，负责校验、渲染、发现、安装与项目模式操作。"
        }
      },
      "layout": {
        "row": 0,
        "column": 0
      }
    },
    {
      "id": "core",
      "role": "backend",
      "name": "Birdify Core Runtime",
      "kind": "local",
      "responsibility": "Core runtime for data contracts, validation, HTML rendering, constraint workflows, and installed skill asset discovery.",
      "ownership": [
        {
          "kind": "file",
          "path": "packages/core/src/index.ts"
        },
        {
          "kind": "file",
          "path": "packages/core/src/render.ts"
        },
        {
          "kind": "file",
          "path": "packages/core/src/validate.ts"
        },
        {
          "kind": "file",
          "path": "packages/core/src/runtime-root.ts"
        },
        {
          "kind": "file",
          "path": "packages/core/src/constraint-rule-view.ts"
        }
      ],
      "evidence": [
        {
          "path": "packages/core/src/index.ts",
          "symbol": "renderArchitecture",
          "note": "Shared package exporting contract schemas, rendering engine, and constraint utilities.",
          "translations": {
            "zh": {
              "note": "导出数据契约规范、渲染引擎与规则提取工具的核心共享包。"
            }
          }
        },
        {
          "path": "packages/core/src/runtime-root.ts",
          "symbol": "runtimeRoot",
          "note": "Resolves skill assets from BIRDIFY_SKILL_DIR, project/development paths, or global agent skill directories.",
          "translations": {
            "zh": {
              "note": "按 BIRDIFY_SKILL_DIR、项目/开发路径及智能体全局技能目录查找技能资源。"
            }
          }
        }
      ],
      "status": "supported",
      "openQuestions": [],
      "translations": {
        "zh": {
          "name": "Birdify 核心运行时",
          "responsibility": "提供数据契约、校验、HTML 渲染、约束工作流与已安装技能资源查找。"
        }
      },
      "layout": {
        "row": 0,
        "column": 1
      }
    },
    {
      "id": "skill-payload",
      "role": "generic",
      "roleAssessment": {
        "basis": "out-of-taxonomy",
        "note": "Static skill package for agent hosts delivering prompt rules and schemas rather than a process role.",
        "translations": {
          "zh": {
            "note": "面向智能体宿主的静态技能资源包，提供提示词规则与数据规范。"
          }
        }
      },
      "name": "Birdify Skill Payload",
      "kind": "local",
      "responsibility": "Separately installed agent skill containing workflow instructions, schemas, release metadata, and viewer assets loaded by the CLI at runtime.",
      "ownership": [
        {
          "kind": "file",
          "path": "birdify/SKILL.md"
        },
        {
          "kind": "file",
          "path": "birdify/skill-release.json"
        },
        {
          "kind": "file",
          "path": "birdify/schemas/architecture.schema.json"
        },
        {
          "kind": "directory",
          "path": "birdify/assets"
        }
      ],
      "evidence": [
        {
          "path": "birdify/SKILL.md",
          "symbol": "Birdify",
          "note": "Skill entrypoint declaring activation modes and architecture mapping workflow.",
          "translations": {
            "zh": {
              "note": "技能入口文档，声明激活模式与架构地图映射流程。"
            }
          }
        }
      ],
      "status": "supported",
      "openQuestions": [],
      "translations": {
        "zh": {
          "name": "Birdify 技能包载荷",
          "responsibility": "独立安装的智能体技能，包含工作流指令、数据契约、发布元数据和供 CLI 运行时读取的查看器资源。"
        }
      },
      "layout": {
        "row": 0,
        "column": 2
      }
    },
    {
      "id": "viewer-template",
      "role": "frontend",
      "name": "Viewer Template Source",
      "kind": "local",
      "responsibility": "Interactive viewer UI source in TypeScript, providing canvas routing, dark/light themes, and bilingual support.",
      "ownership": [
        {
          "kind": "file",
          "path": "templates/viewer/main.ts"
        },
        {
          "kind": "file",
          "path": "templates/viewer/constraint-canvas.ts"
        },
        {
          "kind": "file",
          "path": "templates/viewer/theme.ts"
        }
      ],
      "evidence": [
        {
          "path": "templates/viewer/main.ts",
          "symbol": "init",
          "note": "Interactive browser runtime providing SVG bezier routes, filtering, and constraint graphs.",
          "translations": {
            "zh": {
              "note": "交互式浏览器运行时，提供贝塞尔连线路由、筛选与约束图画布。"
            }
          }
        }
      ],
      "status": "supported",
      "openQuestions": [],
      "translations": {
        "zh": {
          "name": "查看器模板源码",
          "responsibility": "交互式前端查看器 TypeScript 源码，实现画布路由连线、明暗主题与双语控制。"
        }
      },
      "layout": {
        "row": 1,
        "column": 0
      }
    },
    {
      "id": "dev-tooling",
      "role": "generic",
      "roleAssessment": {
        "basis": "out-of-taxonomy",
        "note": "Repository-only development CLI and maintenance commands, outside the product role taxonomy.",
        "translations": {
          "zh": {
            "note": "仓库内部开发 CLI 与维护命令，不属于产品角色分类。"
          }
        }
      },
      "name": "Birdify Dev Tooling",
      "kind": "local",
      "responsibility": "Repository-only development CLI that builds viewer assets, exports Core schemas, and runs build, documentation, and package checks.",
      "ownership": [
        {
          "kind": "directory",
          "path": "toolings/birdify-dev/src"
        }
      ],
      "evidence": [
        {
          "path": "toolings/birdify-dev/src/commands/build-viewer.ts",
          "symbol": "buildViewer",
          "note": "Bundles templates/viewer into birdify/assets/ using esbuild and syncs Lucide icons.",
          "translations": {
            "zh": {
              "note": "使用 esbuild 将 templates/viewer 编译打包到 birdify/assets/ 并同步图标。"
            }
          }
        },
        {
          "path": "toolings/birdify-dev/src/commands/check-install.ts",
          "symbol": "verifyPackedCli",
          "note": "Checks packed CLI against repository skill assets copied into an isolated .agents/skills/birdify home.",
          "translations": {
            "zh": {
              "note": "将仓库技能资源复制到隔离的 .agents/skills/birdify 主目录，验证打包后的 CLI。"
            }
          }
        }
      ],
      "status": "supported",
      "openQuestions": [],
      "translations": {
        "zh": {
          "name": "开发脚手架工具",
          "responsibility": "仓库内部开发 CLI，负责构建查看器资源、导出 Core Schema，并运行构建、文档和打包检查。"
        }
      },
      "layout": {
        "row": 1,
        "column": 1
      }
    },
    {
      "id": "site-app",
      "role": "frontend",
      "name": "Official Landing Site",
      "kind": "local",
      "responsibility": "Vue 3 landing page application built with Vite for GitHub Pages showcasing Birdify features.",
      "ownership": [
        {
          "kind": "file",
          "path": "apps/site/src/App.vue"
        },
        {
          "kind": "file",
          "path": "apps/site/src/main.ts"
        },
        {
          "kind": "file",
          "path": "apps/site/index.html"
        }
      ],
      "evidence": [
        {
          "path": "apps/site/src/App.vue",
          "symbol": "App",
          "note": "Vue 3 single page application with cyberpunk night city visual styling and interactive installation tabs.",
          "translations": {
            "zh": {
              "note": "采用夜之城赛博朋克视觉风格的 Vue 3 单页应用，提供交互式安装指引。"
            }
          }
        }
      ],
      "status": "supported",
      "openQuestions": [],
      "translations": {
        "zh": {
          "name": "官方网站应用",
          "responsibility": "基于 Vue 3 + Vite 构建的静态官网，用于 GitHub Pages 部署并呈现 Birdify 功能与安装指引。"
        }
      },
      "layout": {
        "row": 1,
        "column": 2
      }
    }
  ],
  "relationships": [
    {
      "id": "rel-cli-to-core",
      "from": "cli",
      "to": "core",
      "kind": "dependency",
      "visibility": "overview",
      "label": "invokes core API",
      "evidence": [
        {
          "path": "apps/cli/src/commands/validate.ts",
          "symbol": "checkArchitecture",
          "note": "CLI commands import and execute validators and renderers from @birdify/core.",
          "translations": {
            "zh": {
              "note": "CLI 命令导入并执行 @birdify/core 的校验器与渲染器。"
            }
          }
        }
      ],
      "status": "supported",
      "openQuestions": [],
      "translations": {
        "zh": {
          "label": "调用核心 API"
        }
      }
    },
    {
      "id": "rel-core-to-skill",
      "from": "core",
      "to": "skill-payload",
      "kind": "dependency",
      "visibility": "overview",